"InputStoryid","InputSentence1","InputSentence2","InputSentence3","InputSentence4","RandomFifthSentenceQuiz1","RandomFifthSentenceQuiz2","AnswerRightEnding"
b929f263-1dcd-4a0b-b267-5d5ff2fe65bb,All my friends like to dance at the club.,They think it's fun and always invite you.,I finally decided to join last Saturday.,I danced so badly that I broke my friend's toe.,My friends have decided not to ask me out anymore because I don't have that much fun.,"The following weekend, I was not asked to stay home.",2
7cbbc0af-bcce-4f56-871d-963f9bb6a99d,"One day, I wanted to go to the park.",The weather seemed fine for a walk.,"Within minutes of getting there, I started sneezing.",My eyes were watering and I was breathing heavily.,My allergies weren't too bad and I didn't go home.,Reminds me of how much I dislike spring flowers.,1
4745d627-be9b-45f2-ad92-99c82cc83f85,Avery is married with children.,She was tired of her boring life.,"One day, she decided to meet an old guy from the university.","That night, she made the wrong decision to be unfaithful to her husband.",Avery doesn't think her children will be happy with her decision,The next day Avery did not regret his actions.,2
6bc5a855-3a02-454c-8d8b-4428b1864f95,Josh loves it when his mum makes apple pie.,He doesn't like always having to wait until dinner time.,"So, he decided to sneak a bite this time before dinner.",The eggs his mother used were probably bad.,Josh didn't think the pie was tasty.,Josh is not sick.,2
2f74e81d-957b-4541-9e66-59e5eaa6aef1,John wrote the lyrics for his new album.,He began to encounter writer's block.,"He tried to force himself to write, but to no avail.","He takes walks, socialises with friends and observes nature.","He felt uninspired, and then he went home and wrote.",John had no idea about his paintings at the time.,1
325503ab-11f5-416d-81fb-3980793ca6f7,The cashier is counting dollar notes on the desk.,Two men broke into the shop and grabbed a firearm.,Everyone got scared and started screaming.,These people threatened people to keep quiet.,The cashier didn't give them cash to leave.,The treasurer did not invite the men to the high school meeting.,1
794c804e-89ca-47b1-a583-7300e0509764,"Next door, Mills has a new car.",The car was stolen over the weekend.,They came to my house and asked me if I knew anything.,"I told them no, but for some reason they suspected me.",They didn't call the police to my house.,Then they didn't like me.,1
ece6f206-49ab-4c70-8a65-d6d2b0c97610,He was a very unpleasant boy in Kerry's economics class.,He monopolises every classroom discussion with his banal ideas.,The professor could never keep him quiet.,"One day, he came to class with a laryngitis.",Kerry was not disappointed.,Kerry wasn't so grateful!,2
61d1df75-b64c-485d-9599-0dd7f8809433,Franny doesn't like all immigrants.,She believes that immigrants are here to cause social problems.,"When an immigrant moves in next door, Franny starts to get upset.","The new arrival, Sal, was friendly and befriended Franny.",Franny was not eventually deported.,Franny has not yet learned to check her prejudices.,2
482130ae-9698-477e-a20e-76b48d99a2e3,Brandon is to write a 10 page research paper for the class.,He started writing this article on a Dell laptop in 2003.,Brendan stayed on the job until 1am.,"Suddenly, his computer crashed and died.","When he didn't finish the article, he went to bed.","Fortunately, it doesn't keep everything on an external hard drive.",2
3f076ec0-6985-418d-bb75-45b437aceca0,Ali spends $20 a day on savoury vegetables.,"To save money, he decided to do it himself.",He put the pickles in brine.,Ali waited two weeks for the pickles to sour.,ari opens the jar and finds incomplete pickles.,Aria pickles are not sweet.,1
b5bc0ca6-03b0-43c0-8114-20186b5f783b,Trudy wants to write novels for a living.,One was written using traditional publishing means.,She barely made enough money to cover the advance she received.,The second is self-published.,Trudy doesn't expect self-publishing to be more lucrative.,Trudy did not call her sister and invite her over for dinner.,1
43ff94c9-d83c-4ac5-bb44-d91f808c1e61,Feliciano used to pick olives with his grandmother.,She tells him stories of her ancestors as she picks.,"Before he knew it, the sun was setting.",They took the olives home and ate them together.,Then go and pick olives.,Feliciano was not happy with his good time.,2
5b2f7f43-ce2f-4405-9576-21ef0ae67612,Aaron's girlfriend invited him over for dinner.,She said she would prepare his favourite dish - Chicken Alfredo.,"Aaron was excited, she wanted to cook, but he hated Alfredo.",She must have confused his words when he told her that he liked her the least.,Aaron did not suggest helping her prepare another meal.,Aaron did not break up with her.,1
d9dde843-ee66-4dca-820a-c3d489ba586f,Oliver was nervous about the wedding.,He was worried that he would stammer during the oath.,"When the time came, he took a deep breath and began to speak.","He stammered, but my wife laughed and hugged him, so he was fine.",Oliver has decided not to get married.,oliver was not grateful for his wife's love.,2
705d7e4d-3b56-48dc-9dad-9b14eff97d95,Sara lost her cat.,She is so sad!,She put up signs all over the neighbourhood.,Then something wonderful happened.,Sarah did not break her leg.,Someone hasn't found their cat yet.,2
a37be14a-7724-464c-8344-87624fafaa34,Kylie is playing her new Mario game.,She has been playing for a few weeks now.,She hadn't beaten the level in all the time she had played.,"Finally, it passed the last stage.",Kelly wasn't angry about it.,kelly wasn't so happy to have finally beaten her.,2
17cfe8c3-561d-4910-8644-0565deccbe79,Tim and Debbie have been dating for almost a year.,They met at a party they attended last Christmas.,Tim picked up Debbie's date this evening and took her out for a nice dinner.,"Immediately after dessert, he proposed marriage.",Deb did not say yes to Tim's proposal.,Deb didn't say she was only interested in women.,1
87aa1560-0c24-4a6d-8507-6ae058e4422a,My roommate is German.,He is a very good cook.,One day he made me the sausages he had eaten in his old home in Germany.,"The sausage, he said, did not work well.",I didn't think the cereal was good.,I don't love them anyway.,2
9cba37ea-cc3e-4775-b044-c3d3d4983d22,"When I was a kid, I wanted to play chess so badly.",I sat with my grandfather and he taught me.,"At first he just taught me, but then it turned into something special.","As I got older, I continued to play checkers with him.",I still hate the chessboard.,I don't remember the chessboard very well.,2
a0769cd4-45a0-492c-a566-b14b9b17cba6,"Ivy, like her friends, wanted a mobile phone.",She saves money by delivering newspapers.,"Soon, she had made enough of a phone call.",She went shopping and picked out the perfect phone.,Amy doesn't spend all her money on clothes.,She doesn't like her new phone.,2
40f3b904-81c7-4e92-b245-ff20840733a2,Dave walks into a grocery shop.,He wanted to buy his favourite energy drink there.,He only had enough money to buy one can.,"When he reached the corridor, he smiled.",Dave didn't buy the whole box.,is not for sale.,2
b00c883d-782a-428a-be8d-1749a200575f,Gina sat on her grandfather's bed and looked out.,It was winter and his garden was dead by spring.,"Her grandfather had died, so there was no one to look after him.",Weeds will take over and choke the flowers.,Gina didn't ask her grandfather which flower he liked best.,Gina didn't decide to go out and pick some weeds.,2
1d3e5ddd-76a9-401d-8c5c-a6f5f0bd7160,Ramona is very unhappy with her job.,She asked for a pay rise but was refused.,"After being rejected, she began actively browsing search ads.",She found an interesting new opportunity and arranged an interview.,she was not offered a new job with a higher salary,There is no reason why Ramona should not want to change jobs.,1
34ddd737-0709-4fc7-b64b-6c43eaf9f48c,I would like to buy a game console.,I asked my parents and they came up with the idea.,"I was told that if I fulfilled my obligations, I would get money to deposit.","Throughout the summer, I did my duty every week, unaided.",My parents didn't give me enough money to buy a game console.,"At the end of the summer, I didn't pay my parents back.",1
fc416bf8-23b2-41af-b4bf-ffc544321166,Felipe has been interested in Germany since he was a child.,He learns about the language and culture by reading books in the library.,"At university, he was finally able to go to Berlin.","Felipe loves German art, food and beer.",Felipe never wanted to go to Germany again.,Felipe has never been to Germany again in his life.,2
d8079c78-7eda-4006-a7f5-993cc1456bcb,Myers is a roofer.,He loves his job and is very good at it.,"One day, he fell off the roof without looking.","Fortunately, he only broke his leg.",Ree did not get up to leave.,Ree has not yet decided that he needs to be more careful.,2
de97e427-f428-4b4e-80e6-b22b80a9f3f1,"Johnny thought Anita was his girl, but he was wrong.","He asked her out, but she said she wasn't feeling well.",Johnny decided to go to the club to drink and listen to music.,"At midnight, he looked back and saw Anita dancing with another man.",Johnny didn't want to ask Anita out again.,Johnny didn't ask Anita out again.,2
4d1e86d9-f613-47c4-848e-0e4b9fbe3dce,His eyes burned with pain.,His stomach churned and twisted.,His lungs were filled with fluid.,A painful coughing fit resounded in the hallway of his small home.,He was certainly not close to death and he should have left before the night was over.,He didn't stand up and decided to go for a run.,1
c9bc611e-b71c-48e9-a3d3-4a4ebcb9a8cc,Tom is preparing for the big test.,Then he fell asleep out of boredom.,He slept for five hours.,He woke up shaken.,Tom is in no hurry to study as much as possible before the exam.,Tom didn't feel ready to take the exam.,1
7ef8e330-87c0-45f1-a4ac-c51818a46ac5,The friends had lunch and gathered around the table.,Ben was ravenous and finished his lunch before anyone else.,He went back to the lunch queue to get more food.,It did not shape him.,He didn't decide to buy more lunch and he didn't feel bad about it afterwards.,Then he didn't stop eating because he wasn't full.,1
86178f58-f674-42bc-91f8-23038c98197a,Jill's father took her to pick out a kitten.,There are two in the cage.,She could not leave any of them behind.,Her father agreed.,Jill and her father did not bring a cat home.,Jill and her father did not take the two kittens home with them.,2
2a41a1bd-54d3-40cb-ba38-eba5e3c5c31c,Today was my first class trip.,Our class went to the playground at the back of the school.,Many students and professors were resting on towels on the floor.,"In addition, a number of sporting events were held.",I didn't get a good tan that day.,I didn't get hit in the face with a football and I didn't get a black eye.,1
50a2e0a9-17b0-4670-9e3b-7c7a0bcf3512,Dogs stopping at the pond to drink water.,He replaced his reflection with that of another dog.,"Wanting to fight, he jumped into the water.","Unsurprisingly, his opponents proved to be elusive.",The dog didn't run home with its tail between its legs.,The other dog did not hit him or bite his ear.,1
1257ebe1-6a10-49c0-bd35-28ca88e2baec,Peter wanted to show his daughter his favourite Christmas songs.,He played a video of the song for her.,Then he told her to listen to the background music.,"For the last time, he decided to sing a song to her.",Peter doesn't hate Christmas.,Peter's daughter does not like music.,2
00c4e875-144a-4c40-b83a-08a7e9926253,Mr Yao is a keen gardener.,"He had a large garden in his backyard, which he loved very much.",He decided to take his vegetables to the local fair.,He waited expectantly for the outcome.,Yao Ming does not fall into two categories.,The judges did not reward him for not eating Yao's vegetables.,1
e347459b-dd6e-4b4e-afae-7bbb45964184,Mary loves to jump rope.,She does it all the time.,This has kept her in good shape.,She was always full of energy.,Mary didn't lose her job because she didn't have the stamina,Mary is not happy that she has learned to jump rope.,2
606f2a0b-3565-4cf8-8b95-efc4196a5ef3,I was in a bar with a friend.,It was my turn to buy bullets.,I walked up to the bartender and asked him for 13 beers and a glass of wine.,He asked for my card and accepted the order.,He didn't tell me to go to hell.,Haven't completed my order yet.,2
c2053646-85b1-41b4-8244-bfb1a2c21029,Scott was hungry.,He decided to make dinner.,He made tortillas.,He's done enough to share with his friends.,His friend didn't like the tacos Scott made.,His friend was not so offended that he did not ask Scott to leave.,1
1e65a4f0-bc9e-4ff7-84e0-8eff744d95aa,Jorel wants to try out for the basketball team.,He practiced hard.,"On the day of the exam, he was very nervous.",His approach paid off.,Not invited to join the team.,He didn't play badly.,1
4970b8a1-f2b4-4cfd-85d0-0e93edbd86f7,Beth and Carol went to China.,"After dinner, Beth opened her fortune biscuit.",Beth expects to be lucky by the end of the week.,Beth called her later in the week to tell her the good news.,Beth's dog was not hit by a car!,Beth didn't exactly win the lottery!,2
f6f37f29-ff73-4b5b-980c-55b0a2d1340c,Sally loves the soda her mum buys her.,She pulled one out of the fridge.,She was happy to open it and try it out.,Sally had no idea that her brother had scared them all.,The water is not very calm.,The water did not explode.,2
e0644cca-3711-444f-ba22-22e701d18fa9,The bride and groom walk down the aisle.,They finally got married.,The wedding took place at a country club.,"When the bride threw her bouquet, her best friend caught it.",Her best friend wasn't angry.,Her best friend was not impressed.,2
facc8d6c-0f9d-472a-aa08-a7bacb41d38b,Gordon is catching up on meetings.,He flew out of the laboratory and slipped on the ice outside.,When he stood up he found his wrist had been ripped off.,He barely made it to his appointments on time.,Gordon won't be fired for being late to meetings,Gordon makes no promises to be more careful next time.,2
cd4c6628-e2b1-4959-afaf-e3008821b177,Two elderly ladies chatting over lunch in the park.,One of the men brought a basket and placed the food on the table.,They chatted and ate happily until they started arguing about something.,One of the men threw a piece of cake at the other and a food fight began.,The police did not have to come and stop the conflict.,They didn't add to the deliciousness of the cake.,1
11c99af0-78e8-414d-b78c-2c70fe407ba6,Mike has a beautiful girlfriend.,One day he was walking in the school yard.,He saw his girlfriend with another man.,The other boy was his friend Bob.,mike is not happy not to walk in the school playground.,mike is not sad to see his girlfriend with someone else.,2
7ac29522-a873-4083-832c-cf8fbbf3d1dd,Kara lost her dog yesterday,She was scared.,Carla searched the whole city for him.,The last time she found the dog was in a neighbour's yard.,Carla did not ask her neighbour not to put dog food in the yard.,Kara didn't buy a pet and paint it pink.,1
1055bd28-9480-4e7e-8b5c-68575b03911b,Every year we attend a barbecue by the pool at our aunt's house.,"One year, when my sister was very young, she fell into a swimming pool.","When my father realised she was gone, he ran to the pool.","It sank, pulling my sister to the surface.",We weren't all relieved when it wasn't resolved.,Then we didn't allow her to go swimming.,1
44b83c91-61e5-48e1-aa8b-a4712e3b837a,The harpooner hit the whale and the whale staggered and started to run away.,Everything was fine and a few minutes later the whale made a deep sound.,The line is not paying fast enough and the bow is sinking deep.,The boat slipped beneath the waves and did not rise again.,The harpooner did not go down with the ship.,The harpooner is not present on the board.,1
054e6e40-539e-4b88-b81d-acec771d42cb,Sarah was hungry.,"She went to the kitchen to eat, but all she got was bread.",She made toast with butter and jam.,"As she walked to the table, she dropped her toast.",Sarah wasn't that depressed.,Sarah was not impressed as she dropped the toast.,1
f82aee98-72da-4a92-b898-d4d362101498,The day after Christmas we left North Carolina and headed for Florida.,"After a long drive, we couldn't wait to get there.",We spent time with our families and visited Disneyland.,We spent a whole day in the Magic Kingdom.,"Afterwards, we didn't go home and slept soundly.",Then we didn't leave Six Flags and went home.,1
099edf1f-91ae-4f8c-b9ed-4e921a7c3b02,Nicole's greatest ambition is to become an aunt.,The problem is that she has no siblings.,Today Nicole received a message from her cousin Xiao.,Xiao and her husband are pregnant with a baby boy.,She did not think she could be an honorary aunt.,She hasn't decided that she doesn't like children.,1
fee44088-f58d-4ef9-93dc-cffe69f03d77,Mary and Emma drove to the beach.,They decided to swim in the sea.,Mary turned to Emma.,Emma said to watch out for the waves.,The sea is not as calm as the bathtub.,Mary was not caught in the big wave.,2
cef2eb7e-2792-46b4-9492-dbabc9155829,Jeff has just gotten engaged to his girlfriend Ashley!,They were so pleased that they immediately began planning their wedding.,Within a few hours they realised how expensive it would all be.,Jeff decided to take a part-time job to pay for it all.,Ashley was not offered a part-time job.,Jeff did not resign that day.,1
4989e550-64be-4b0e-a667-fee519fc2980,Josh woke up early to get ready for his planned hike.,"After a shower, he made sure he had all his essentials packed.",He left the house and drove to the park where he was to hike.,"As it was still early, Josh's journey was mostly on his own.",Josh does not like the outdoors.,Josh hates the outdoors.,1
5be778f7-bed0-4ffd-b275-eaa8dd6eb417,"On Friday, there was a basketball game.",My friends and I would like to see it.,We got together and got some money to buy snacks.,We went out into the courtyard and sat down.,We didn't decide to leave when we sat down.,We don't have courtside seats.,2
a524f46d-2122-4d80-9cf6-35e7295e27c1,Anna wants ivy to climb the walls of her house.,She found it strange and fascinating.,She found small ivy and planted it.,Soon they were climbing up the walls of her house.,It wasn't just what she wanted.,She is not very allergic to poison ivy.,1
94d111c2-3c86-40cc-afaa-e9d0a123c3d5,My goal is to do over 200kg on the push-up machine.,"In my gym, this is the heaviest weight on this machine.",Now I can only do about a hundred and fifty kilos.,I have been working on this for over six months.,"I don't know, one day I'll eat a pear.","I don't know, one day I'll get there.",2
36df2002-92f3-4a85-ac47-8df95d219cb2,Ella's father is going to Munich on a business trip.,Ella asked her father to take her with him.,She had never been to Germany and wanted to see it!,Her father agreed and took Ella along on the trip.,She was not disappointed.,Haven't had a good time yet.,2
f2a6a95f-5396-4984-a7a5-06df5b948f40,Henry's parents took him to see his first film.,"Before going in, they bought him some snacks.","In the theatre, they sit in the back row of seats.",Henry enjoyed the whole film.,He didn't keep crying and begging to go home.,No thanks to his parents for not taking him to the cinema.,2
b58034b4-b513-4b73-86e5-57755b8fc4d2,Tim loves swimming with tuna in the deep sea.,I would never hurt them or try to catch them.,"One day, a fishing boat came to the home of the tuna.","The next day, Tim tried diving with the tuna.",Can't find the tune.,It's not about finding a tune.,1
97d25389-0521-4516-bafc-2cec760dbd4a,Mel takes a girl on a date.,They had a wonderful time.,"The next day, he called her and asked for a second date.",He was worried that she would refuse.,It has been a while since I have travelled to Alaska.,"To his relief, she didn't.",2
59201852-aca6-4676-a477-b7c6e6707679,Leila was very excited to meet her favourite rapper.,"After the concert, she had backstage passes.",She came backstage and introduced herself.,"She was horrified to discover that the rapper was drunk, rude and sexist.",lyra did not become one of the rapper's companions.,lyra never listened to rap music again.,2
1ca57071-a5bb-4dcc-b0bf-d5321e6e3845,Caitlin broke one of her mother's best plates while washing up.,Caitlin knew her mother would be angry.,She lied and said her sister had done it.,Her sister was reprimanded.,Caitlin did not feel guilty about coming out to her mother.,Caitlin's sister did not receive her punishment fairly.,1
bb99b560-0513-4756-88fc-0c6aa8cecadb,Andrea is looking for a new pet.,She would like to adopt a dog.,"After visiting a local dog shelter, she decided to rescue a puppy.","After the formalities were completed, Andrea took the dog home.",Andrea did not introduce the dog to her family.,Andrea did not give her dog to a stranger.,1
8cbd5a81-89cb-433c-a34d-ced88c0fdd8d,Will and Anna dated for 12 years.,They went on a beach holiday together.,"While walking on the beach, Will decided to ask her to marry him.",Anna said yes.,Will wasn't very angry because Anna said...... .,"Eight months later, they were not married.",2
65afbe34-fc9d-4834-88b0-64e40acf5a6e,Ellie looked at the carousel.,She couldn't decide which animal to ride.,It contains a pink horse or a blue rabbit.,That's why she sat through it twice.,It upset her every time she didn't ride with the other animals.,Ellie didn't cry either time because she didn't want to be left out.,1
758bfe67-dfe7-4908-93fa-d5825f703f96,I play football with my friends.,We take our places.,"When the game started, they started on me.",I hurt my knee and screamed.,My friends didn't stop playing to help me get off the pitch.,I didn't come back to finish the game.,1
93405aa3-0d24-4bba-8aa8-3a7d4d91bf29,My rehab therapist came to see me today.,You should do a quick workout.,We start with the lower body exercises.,"When I do push-ups, he wants to do more push-ups than I do.",My rehab therapist is not inspirational.,My rehab therapist is not a narcissist.,1
ee44e2e3-efc7-4529-8755-2ff5ac1897d9,I bought my girlfriend new gloves for Christmas.,They are leather and look great.,She liked them and tried them out.,"Unfortunately, they don't fit.",My girlfriend has not yet completed her research in soil management.,I didn't take it back to the shop to buy another size.,2
63a75f76-2746-410e-b102-9dbf97c164e0,Mina lost her handbag in a restaurant.,She was very unhappy!,She thought she would never get her things back.,Then a wonderful surprise awaited Mina.,The stranger did not steal her handbag.,The stranger did not find her bag and returned it to the restaurant.,2
05e5583a-c950-49f3-a03e-80d7f9ccefa6,Pete has found a new job at a software company.,This has been Pete's dream job all his life.,Pete writes down all his good ideas and keeps showing them to his boss.,Pete was soon promoted to assistant manager.,He never left his job and never looked back.,"A year later, he has made no further progress.",2
ddda87a3-3139-44fe-8593-6fd6fd643a3c,I haven't seen my girlfriend in a while.,"She got a new job, so it was hard to talk about it.",Work takes up all her time.,"Finally, she called me to say goodbye.","I wasn't happy not to hear from her, so we didn't break up.",I wasn't happy to see her and we didn't plan anything.,2
d05b6efe-0ec1-441d-9d53-200701babc6b,Gina wanted to be left alone to cry.,The only place she could do that at school was in the toilets.,But people are in the bathroom.,"She stood with her hand on the door, feeling the tears sting her eyes.",She couldn't help but laugh out loud.,"When not crying, not trying to be as quiet as possible.",2
df758982-8116-4c76-b7cb-5f67e0a97914,Gina is watering the garden.,"As her brother walks by, she sprinkles water on him.",He ran around laughing and shouting.,She was joined by her sister and another brother.,Gina wasn't sad.,Gina did not perform well.,2
5a71cb4d-23f8-465a-84ac-a69ca56dfa07,Agata has always wanted a pet bird.,"So one day, she bought two pet parsley plants.","Soon, she could no longer stand their constant bickering.",What's worse is that they keep messing up.,agatha has not yet decided to buy two more.,The agatha has not yet decided to return them.,2
c6653f2f-77a9-4adc-8dd6-64754847a6f3,The boys wanted to go to the cinema.,"They know that if they ask, they can't leave without doing their chores.",They did all the work.,They asked if they could go to the cinema.,Their parents did not say they had to do the chores first.,"Their parents did not say ""yes"" and did not go to the cinema.",2
20165765-4bc3-4a45-9c22-44ff8fd303c5,I noticed that my hair was becoming too long.,"I wanted to cut it out myself, but I couldn't do it.",I put on my shoes and grabbed my keys.,I went to the hairdresser to get my hair cut.,It's not ready yet.,He didn't tell me to cut it myself.,1
3ea721b1-70dd-4222-b25d-4273e80ae312,Sandra couldn't believe that she had finally arrived in Hollywood.,She began auditioning for roles in order to realise her dream of becoming a star.,"When she could not, she had to find a job as a waitress to make ends meet.",She soon discovered that one of her regulars was a talent agent.,Sandra didn't let the agents leave her alone.,"So, she didn't hang out with the agent.",2
7b25f5dd-7081-47e1-99ee-ef1bdc679a00,Sally is going to surprise the office with a cake.,Sally thought she could make them laugh with the cake.,She went to the supermarket to buy a cake.,"In her office, she gathered her staff around a conference table.",Then she didn't bring the cake and everyone didn't feel good.,She didn't tell them she didn't have any cake.,1
16ac16d6-41a4-49f4-a3e1-ec242ce8f921,Sarah taught herself algebra.,"However, after a few weeks, there was no significant improvement.",She realised she hadn't set any goals for herself.,"So, she set herself a goal every day.",Soon Sarah did not start improving the algebra.,Sarah has not given up learning algebra.,1
