"InputStoryid","InputSentence1","InputSentence2","InputSentence3","InputSentence4","RandomFifthSentenceQuiz1","RandomFifthSentenceQuiz2","AnswerRightEnding"
a5af376d-4177-4abd-b85d-3645e120fce5,唐和他的妻子开车去了录像带租赁店。,半小时后，他们无法决定看哪部电影。,唐先生请店主为他们选片。,楼主选择了一部由凯瑟琳-海格尔主演的热门爱情喜剧。,唐先生和妻子没有放弃，回家了。,唐先生和他的妻子没有得到这部电影。,2
0ff6265a-5399-49ee-84d4-422a40a342c2,大小姐喝多了，去纹身。,她决定在额头上刺青。,第二天，大小姐被自己的所作所为吓坏了。,大小姐已经筹到了去除纹身手术的费用。,Missy没有得到另一个纹身 在她的脸颊。,在花了很多钱之后，这个纹身还没有消失。,2
ad95df27-042e-492f-8762-8ba1de02b471,乔恩的状态一直比较差。,乔恩决定减肥。,他开始吃得更好，锻炼身体。,乔恩继续说道，开始感受到了结果。,乔恩看到减肥成果后，并不高兴。,约翰晚餐没有吃汉堡包和薯条。,1
157ed81f-52a5-4cdc-934c-6ee421675cc9,高中足球队获得季后赛资格。,团队很热情，城市很支持。,门的装饰。,这几家公司都是提前关门。,比赛开始时，主队的看台并没有坐满。,城市里没有人关心参加比赛。,1
5c609bdb-3a4f-4f3f-a50b-0f8246ee6841,厄尔早起泡咖啡。,那天他想在工作中醒着。,这个味道把他的室友都吵醒了。,他们也想做咖啡。,不是所有的室友都会煮咖啡。,并不是所有的室友都喝咖啡生病了。,1
71fbcabb-27b4-4449-a161-a8af8e3d4d8f,玛姬有一只狗。,她带着她的狗去散步。,他们去公园玩。,当他们回家后，Maggie喂狗。,Maggie和她的狗不是最好的朋友。,玛吉讨厌花时间 与她的臭狗。,1
41963889-83cc-409d-9bdb-fc26eeb460c2,艾拉正试图选择她的舞会礼服。,她无法决定!,于是她问男友的意见。,他说她选的每一件衣服都很漂亮!,艾拉没有生气，因为她的男朋友没有那么挑剔。,她没有意识到，她选择穿什么真的不重要。,2
d0797834-8c42-44cd-8d2c-3fee56b84e28,本决定在2016年提高自己的体能。,他计划每周至少锻炼四次。,本决定等到下周一再开始训练。,周一过去了，本还没有开始他的锻炼计划。,本从来没有开始或锻炼。,本不是每天都去健身房的。,1
337bde69-adb0-4fb5-aedf-03185ea882d5,泰迪G是一只带盒子的泰迪熊。,他跟你说的都是废话。,我们年轻的时候，我给我老婆买的。,她在女儿三岁的时候给了我们女儿。,我们的女儿并不十分感激这份礼物。,我们的女儿并没有感到沮丧。,1
519cc090-8a11-486c-89e4-1e4c20a41ba5,克里斯有很多鸡。,他每天都从他们那里收集鸡蛋。,他把鸡蛋拿到农贸市场。,大家都很喜欢克里斯的鸡蛋，花了很多钱买。,克里斯没有去开公司，成为成功。,克里斯不能卖任何鸡蛋。,1
638b4ccf-e7cd-4974-bfe4-5500f2342523,我女儿庆祝了她的六岁生日。,我们决定在艺术工作室为她和她的朋友们举办一个聚会。,她所有的朋友都来了，等待指示。,每个朋友都听着指导如何画画。,听完后，孩子们就没有做出漂亮的艺术作品。,那时候孩子们还没有开始自己写歌。,1
ef111a9f-243a-422d-b95a-a367fac80162,我妈妈昨晚开车去了杂货店。,她在红绿灯前停了下来，几个人跑到她家门口。,他们用枪顶着她的头，让她下车。,他们拿着它就走了。,妈妈没有因为布罗迪局长没有关闭海滩而打他。,我妈妈再也不会在晚上去这家店购物了。,2
8c5e75c6-2905-47e6-87c0-0af7673ae9e0,萨尔一直在玩他的游戏。,他打不过9级的世界!,后来他的表哥来了，主动帮他。,两个男孩并肩作战。,他们没有用下午的时间一起看书。,最后，萨尔在表哥的帮助下，没能更上一层楼。,2
