"InputStoryid","InputSentence1","InputSentence2","InputSentence3","InputSentence4","RandomFifthSentenceQuiz1","RandomFifthSentenceQuiz2","AnswerRightEnding"
3db2f1f0-1ec7-4738-b3c5-154b63000671,Looe loves tractors.,"One day, he decided to make one.",It went to the scrap heap looking for parts.,He then took them home.,lewy did not decide to throw away all the worthless parts of the tractor.,Not yet building its own tractors.,2
ed594d9e-4c0f-4110-be41-95859a167e16,"When Bill was young, he couldn't afford to study.","Now, he is an old man who dreams of getting his degree.","At the age of 70, he finally realised his dream.",Everyone is proud of him.,Bill is not very proud.,Bill is not ashamed.,1
83749a3e-53e3-4e7e-9511-ca63638aca7e,Dan saw a dog shivering in the rain and thought he was lost.,The dog was very friendly and Dan was able to take him home.,The animal had no tags or collar and appeared to be malnourished.,Daniel put up signs around the block and asked neighbours.,He was unable to find an owner for the dog that day.,He did not give up and released the dog back into the wild.,1
6ef9c54c-5c2e-4134-8ac0-0e3c978cdb0c,The teacher walks around with a pile of paper.,It's starting to rain outside.,"When the teacher tried to climb some stairs, she fell down.",The document flew out of her hands and landed on the floor.,A passer-by did not help her get up to collect the paper.,"The teacher did not get up and go home, leaving the papers behind.",1
a4649658-7420-442a-8b13-336f991a2e0c,The Bradleys decided to go camping.,They packed up the car and made the two-hour journey.,By the time they arrived it was almost dark and a storm was beginning.,"When the rain stopped, they set up their tents and built a fire.",The Bradleys did not have a pleasant camping trip at the time.,"Without turning around, the Bradleys drove home.",1
a5af376d-4177-4abd-b85d-3645e120fce5,Don and his wife drove to the video rental shop.,"After half an hour, they couldn't decide which film to watch.",Mr. Tang asked the shop owner to choose a film for them.,The owner has chosen a popular romantic comedy starring Katherine Heigl.,Mr. Tang and his wife did not give up and went home.,Don and his wife did not get the film.,2
0ff6265a-5399-49ee-84d4-422a40a342c2,Missy drank too much and went for a tattoo.,She decided to get a tattoo on her forehead.,"The next day, Missy was horrified by what she had done.",Missy has raised the money to pay for the tattoo removal surgery.,Missy didn't get another tattoo on her cheek.,"After spending a lot of money, the tattoo hasn't gone away.",2
ad95df27-042e-492f-8762-8ba1de02b471,Jon's form has been rather poor.,Jon decided to lose weight.,He started eating better and exercising.,"Jon continued, beginning to feel the results.",Jon was not happy to see the results of his weight loss.,John didn't have a hamburger and fries for dinner.,1
157ed81f-52a5-4cdc-934c-6ee421675cc9,The high school football team qualified for the playoffs.,The team is very enthusiastic and the city is very supportive.,The door is decorated.,These companies are closing early.,The home team's stand was not full at the start of the game.,No one in the city cared to take part in the competition.,1
5c609bdb-3a4f-4f3f-a50b-0f8246ee6841,Earl gets up early to make coffee.,He wanted to be awake at work that day.,The smell woke up his roommates.,They also want to make coffee.,Not all roommates can make coffee.,Not all of our roommates got sick from drinking coffee.,1
71fbcabb-27b4-4449-a161-a8af8e3d4d8f,Maggie has a dog.,She takes her dog for a walk.,They went to the park to play.,"When they got home, Maggie fed the dog.",Maggie and her dog are not the best of friends.,Margie hates spending time with her stinky dog.,1
41963889-83cc-409d-9bdb-fc26eeb460c2,Ella is trying to choose her prom dress.,She couldn't decide!,So she asked her boyfriend for his opinion.,He said every dress she chose was beautiful!,Ella wasn't angry because her boyfriend wasn't that fussy.,She didn't realise that it really didn't matter what she chose to wear.,2
d0797834-8c42-44cd-8d2c-3fee56b84e28,Ben decided to improve his fitness in 2016.,He plans to work out at least four times a week.,Ben decided to wait until the following Monday to start training again.,Monday passed and Ben hadn't started his workout program.,Ben never started or exercised.,Ben doesn't go to the gym every day.,1
337bde69-adb0-4fb5-aedf-03185ea882d5,Teddy G is a teddy bear with a box.,What he told you was bullshit.,I bought it for my wife when we were younger.,She gave our daughter to us when she was three years old.,Our daughter was not very grateful for this gift.,Our daughter is not frustrated.,1
519cc090-8a11-486c-89e4-1e4c20a41ba5,Chris has a lot of chickens.,He collected eggs from them every day.,He took the eggs to the farmers' market.,Everyone loved Chris's eggs and paid a lot of money for them.,Chris didn't go on to start a company and become successful.,Chris cannot sell any eggs.,1
638b4ccf-e7cd-4974-bfe4-5500f2342523,My daughter celebrated her sixth birthday.,We decided to hold a party for her and her friends at the art studio.,All her friends came and waited for instructions.,Each friend listened to the instructions on how to draw.,"After hearing this, the children did not make beautiful works of art.",That was before the kids started writing their own songs.,1
ef111a9f-243a-422d-b95a-a367fac80162,My mother drove to the grocery shop last night.,She stopped at the traffic lights and several people ran to her door.,They put a gun to her head and told her to get out of the car.,They took it and went on their way.,Mum didn't hit Chief Brodie for not closing the beach.,My mum will never shop at this shop in the evening again.,2
8c5e75c6-2905-47e6-87c0-0af7673ae9e0,Sal has been playing his game.,He can't beat a level 9 world!,Then his cousin came and offered to help him.,Two boys side by side.,They did not spend the afternoon reading books together.,"In the end, Sal didn't make it to the next level with the help of his cousin.",2
